{
  "schema_version": "1.0",
  "project_id": "yt-MFuUIoF5PSc",
  "rights_status": "self-authored",
  "voice_clone_consent": true,
  "consent_evidence": null,
  "evidence_paths": [],
  "reviewer": "company-standing-authorization",
  "notes": "auto-recorded at init under company standing authorization (rule-5 override)",
  "updated_at": "2026-08-08T06:06:29Z",
  "updated_by": "company-standing-authorization"
}
